{
  "schema_version": "agentswitchboard-invocation/v2",
  "platform": "windows",
  "execution_domain": "windows-wsl",
  "distro": "Ubuntu",
  "requested_agents": ["goose"],
  "operation": "smoke",
  "install_missing_only": true,
  "native_preference": true,
  "bridge_permission": false,
  "posture": "fixture",
  "fixture_scenario": "native"
}
